,id,subreddit,title,selftext,score,upvote_ratio,num_comments,word_length,text,text_length,is_aliens
2293,r768ie,aliens,"Just had this pop up on my FB memories, wonder why Sweden were favourites?",,1,1.0,0,14,pop memory wonder sweden favourite,75.0,1
2294,r74q63,aliens,"Not saying it's aliens, but...",,1,1.0,0,5,saying alien,31.0,1
2295,r74n2g,aliens,"Not saying it's aliens, but it's...",,1,1.0,0,6,saying alien,36.0,1
2296,r7461c,aliens,"So, where is the UFO,?",,1,1.0,6,5,ufo,23.0,1
2297,r723vg,aliens,Where are the aliens?,I've been waiting since 1990.,1,1.0,253,4,alien waiting since,51.0,1
2298,r71r5u,aliens,Not the best at painting but I adapted an old picture I found.,,1,1.0,0,13,best painting adapted old picture found,63.0,1
2300,r707d2,aliens,"Phoenix Lights UFO phenomenon | Aliens of aircraft? The incredible sightings explained | Phoenix, March 13, 1997",,1,1.0,1,17,phoenix light ufo phenomenon alien aircraft incredible sighting explained phoenix march,113.0,1
2301,r6xwy3,aliens,It's Is Written,NEE NED ZB 6TNN DEIBEDH SIEFI EBEEE SSIEI ESEE SEEE !!,1,1.0,5,3,written nee ned tnn deibedh siefi ebeee ssiei esee seee,70.0,1
2302,r6xq6w,aliens,Wierd holes all over my yard,"Sorry accidentally deleted so this is a repost. https://youtu.be/t1haIO7-gbY I've lived in this area my whole life and I've never seen anything like these. The holes were made within 12 hours of the video and I haven't the faintest idea what they're from. The inner walls of the holes are perfectly flat like they're manmade, and nobody but me has been on the property since it last rained. There was a heavy rain last night so the edges wouldn't be so defined if they were old. Probably not aliens, but I'm super confused. Any ideas would be helpful. And no they're not from cicadas so pls don't suggest that lol",1,1.0,5,6,wierd hole yard sorry accidentally deleted repost youtu haio gby lived area whole life never seen anything like hole made within hour video faintest idea inner wall hole perfectly flat like manmade nobody property since last rained heavy rain last night edge defined old probably alien super confused idea would helpful cicada pls suggest lol,642.0,1
2303,r6xabk,aliens,The Alien Cosmonaut,,1,1.0,0,3,alien cosmonaut,20.0,1
2304,r6wg75,aliens,(Serious) Wtf are these?? I can't find anything like them online,"[https://www.youtube.com/watch?v=t1haIO7-gbY](https://www.youtube.com/watch?v=t1haIO7-gbY) 

These holes suddenly appeared all over my yard and I just can't make heads or tails of how they got there or what they are. The inner walls of them are perfectly flat, and they don't seem to be very deep. Some are small enough I thought maybe insects could have made them, but some are over an inch and a half in diameter. They completely surround my house so they don't seem to be from moles or shrews or anything. I just can't figure this one out.",1,1.0,27,11,serious wtf find anything like online youtube com watch haio gby youtube com watch haio gby hole suddenly appeared yard make head tail got inner wall perfectly flat seem deep small enough thought maybe insect could made inch half diameter completely surround house seem mole shrew anything figure one,607.0,1
2305,r6we49,aliens,"Notes, background, and outstanding questions regarding UAP disclosure",,1,1.0,0,8,note background outstanding question regarding uap disclosure,70.0,1
2306,r6w8rv,aliens,Bizarre holes all over my yard,,1,1.0,0,6,bizarre hole yard,31.0,1
2307,r6w4mf,aliens,Bizarre holes in my yard. Any ideas?,,1,1.0,0,7,bizarre hole yard idea,37.0,1
2308,r6w2zm,aliens,Any idea what these could be?,"The inner walls of the holes are perfectly flat like a pipe was stuck into the ground. Some of the holes are small enough to be from cicadas but most are too big and it's too cold for that this time of year. I'll try digging tomorrow, but they don't seem to be any deeper than 1/2 an inch.",1,1.0,0,6,idea could inner wall hole perfectly flat like pipe stuck ground hole small enough cicada big cold time year try digging tomorrow seem deeper inch,319.0,1
2309,r6vk58,aliens,"Just an observation/thought exercise here. Likely nothing, buuut...Delta and Omicron virus variants? Like Bob Lazar's description on the configuration/drives on the sports model. Any thoughts?",Just an odd observation. Whatcha think?,1,1.0,8,25,observation thought exercise likely nothing buuut delta omicron virus variant like bob lazar description configuration drive sport model thought odd observation whatcha think,232.0,1
2310,r6vcmc,aliens,"The ""wombo"" neural network drawing app, when given various ""alien themed prompts"".",,1,1.0,0,12,wombo neural network drawing app given various alien themed prompt,83.0,1
2312,r6skn2,aliens,Following this group inspires me to draw. Just a number 2 pencil and some paper.,,1,1.0,0,15,following group inspires draw number pencil paper,81.0,1
2313,r6sfsh,aliens,Alien views on reincarnation?,,1,1.0,0,4,alien view reincarnation,30.0,1
2314,r6s9i1,aliens,Light in the sky at 3:00am in California. Never seen this before,,1,1.0,0,12,light sky california never seen,65.0,1
2316,r6qtlh,aliens,"Remote viewing training Would you love to know how to mind travel? See the future? Talk to aliens? Visit the past Antarctica? Go to ancient Egypt, see who built the Giza pyramid? Know your past lives? Truth about a conspiracy? Learn the mysteries of the universe or simply find your lost keys?",Dec 7th is the next training class. We meet every Tuesday for 6 weeks live on zoom at 5:30pm MST. Those that complete the training will be a certified remote viewer. Black Friday deal 50% off. Learn more about your trainer in the about us section. https://expandedconsciousnesstraining.com/shop/ols/products/ecrv-expanded-consciousness-remote-viewing-foundation-course,1,1.0,0,52,remote viewing training would love know mind travel see future talk alien visit past antarctica ancient egypt see built giza pyramid know past life truth conspiracy learn mystery universe simply find lost key dec next training class meet every tuesday week live zoom mst complete training certified remote viewer black friday deal learn trainer section expandedconsciousnesstraining com shop ols product ecrv expanded consciousness remote viewing foundation course,662.0,1
2317,r6pc0f,aliens,Multiple UFO'S over Englewood Florida 12/1/21 @ 12:00 pm.,,1,1.0,1,9,multiple ufo englewood florida,58.0,1
2318,r6p47i,aliens,My UFO sighting,,1,1.0,0,3,ufo sighting,16.0,1
2319,r6n5ae,aliens,A Pentagon UFO Cover Up,,1,1.0,0,5,pentagon ufo cover,24.0,1
2320,r6mn4j,aliens,Looking for a video,"Hello, I'm looking for a particular video of an alien encounter. A guy either riding a quad or snowmobile through a snowy forest with a dog. The dog stops and seems afraid to continue on for a few seconds. When the dog does move on with rider in tow his headlights light up an ET standing behind a woodpile. The dog takes off in fear followed closely by the rider. I saw it once on an alien compilation sighting but it's like it has disappeared from the internet. I know reddit is the best place to ask.",1,1.0,15,4,looking video hello looking particular video alien encounter guy either riding quad snowmobile snowy forest dog dog stop seems afraid continue second dog move rider tow headlight light standing behind woodpile dog take fear followed closely rider saw alien compilation sighting like disappeared internet know reddit best place ask,523.0,1
2321,r6m3d8,aliens,"ROSS COULTHART unloads on the Gillibrand Amendment, Meta-materials, UFOs at Pine Gap, Private Corporations doing UFO monitoring and back engineering, and a lot more... DETAILS in first comment",,1,1.0,7,28,ross coulthart unloads gillibrand amendment meta material ufo pine gap private corporation ufo monitoring back engineering lot detail first comment,193.0,1
2322,r6lj4m,aliens,Aliens on the earth,"What if aliens are already here?
I think they are and we just don’t it yet or they don’t.",1,1.0,19,4,alien earth alien already think yet,109.0,1
2324,r6l3q2,aliens,"I need that 1 in a billionth of a person to read this, no BS.",,1,1.0,0,15,need billionth person read,62.0,1
2325,r6k7or,aliens,I am geting there,,1,1.0,0,4,geting,18.0,1
2327,r6j1ts,aliens,I was abducted last night,The doctor said my butt is fine and it’s a case of Proctalgia Fugax. It’s not. That syndrome isn’t even studied. They did something to me starting from my butt. I don’t remember much but I woke up with huge pain in my butt. They are probably injecting some dna into my prostate. Lucky for me I’m a pussy repellant. Some of you wont believe me but know what I remember.,1,1.0,21,5,abducted last night doctor said butt fine case proctalgia fugax syndrome even studied something starting butt remember much woke huge pain butt probably injecting dna prostate lucky pussy repellant wont believe know remember,394.0,1
2330,r6iawc,aliens,What do you think Aliens think about depopulation?,"What do you think Aliens think about depopulation Earth? We are pretty much all aware that there is not an infinite amount of resources here and someday we will consume them all. If the population continues to increase as naturally it does. We may eventually(or already have?) get ourselves in a situation where we cannot resolve our over population issues.  
Touchy subject, we cant just go around mass killing people, having a lottery, maybe another war? Maybe its already began? 

I would hope Alien friends would help us. But I wonder if they would have a different view point for different reasons that we are unaware of. Thoughts?",1,1.0,72,8,think alien think depopulation think alien think depopulation earth pretty much aware infinite amount resource someday consume population continues increase naturally may eventually already get situation cannot resolve population issue touchy subject cant around mass killing people lottery maybe another war maybe already began would hope alien friend would help wonder would different view point different reason unaware thought,687.0,1
2331,r6hvrl,aliens,"Aliens = TheJinn , Sufi prospective ( religious prospective)",,1,1.0,1,9,alien thejinn sufi prospective religious prospective,61.0,1
2332,r6hayv,aliens,Is it the china ai?. I am a dog. Please tell me.,.,1,1.0,1,12,china dog please tell,50.0,1
2333,r6gsyb,aliens,Any new UFO documentaries on the horizon?,Does anyone know of any high quality UFO documentaries on the horizon? I know that James Fox is supposedly making a follow up on the Phenomenon. I really enjoyed the Starz documentary as well.,1,1.0,18,7,new ufo documentary horizon anyone know high quality ufo documentary horizon know james fox supposedly making follow phenomenon really enjoyed starz documentary well,234.0,1
2334,r6dej6,aliens,What If we are the last ones?,"We have pretty much a clear view of the moon from any telescope and we had men on It, no signs of life, we sent rovers to Mars and It looks like whatever life would have been there has been long gone 

So that got me thinking.. If we somehow managed to check every planet and none of them have life.. what does that mean? What If we really are alone In our galaxy?",1,1.0,23,7,last one pretty much clear view moon telescope men sign life sent rover mar look like whatever life would long gone got thinking somehow managed check every planet none life mean really alone galaxy,394.0,1
2335,r6ddgb,aliens,Ancient Aliens pisses me off so bad because....,"I can see some of the theories being plausible, but then BAM!!! Bullshit. Every time.",1,1.0,4,8,ancient alien piss bad see theory plausible bam bullshit every time,133.0,1
2338,r65ffo,aliens,Strange footage out of Wayne County Michigan around 10 P.M. Nov 30 Maybe UFO?,,1,1.0,0,14,strange footage wayne county michigan around nov maybe ufo,78.0,1
2339,r63ch7,aliens,What is the best non-fiction book on UFOs/aliens?,"I'm wanting to read some quality books that cover the topic of UFOs/ETs. I'm looking at buying some of Jaque Vallee's stuff, but don't even know where to start - he's got a bunch of books out.

Does anyone have any suggestions? I read The Day After Roswell back in high school (14+ years ago) and want another read that will leave an impression on me like that book did.",1,1.0,34,8,best non fiction book ufo alien wanting read quality book cover topic ufo ets looking buying jaque vallee stuff even know start got bunch book anyone suggestion read day roswell back high school year ago want another read leave impression like book,420.0,1
2340,r62q6x,aliens,"There were some great posts where someone collected a bunch of videos, witness testimonies etc and provided links. Is there somewhere I can find it?",Is there somewhere I can find it?,1,1.0,10,25,great post someone collected bunch video witness testimony etc provided link somewhere find somewhere find,182.0,1
2342,r61qyf,aliens,Interesting stuff here for those who have the time,,1,1.0,0,9,interesting stuff time,51.0,1
2344,r60i50,aliens,Need Graphic Designer for UFO/alien Game,"As the post says, I am looking for an artist to do the artwork for a UFO/Alien game I am working on. Ideally, they will be proficient in 2d design and 3d modeling, with knowledge of after effects. Worst case, I hire 2 or 3 artists to the team to cover all the bases. 

Please comment or dm if you would be interested, or forward this post if you know someone who would. 

Thanks in advance!",1,1.0,8,6,need graphic designer ufo alien game post say looking artist artwork ufo alien game working ideally proficient design modeling knowledge effect worst case hire artist team cover base please comment would interested forward post know someone would thanks advance,431.0,1
2345,r5yjtr,aliens,THE REAL MEN IN BLACK! MY THOUGHTS,,1,1.0,0,7,real men black thought,35.0,1
2346,r5xda9,aliens,"The crazy days of Ufoology in 1988 - - The AMOCO Alien, a classic from 1988 and the beginning of Area 51 disinformation campaign",,1,1.0,0,24,crazy day ufoology amoco alien classic beginning area disinformation campaign,129.0,1
2347,r5xbhu,aliens,my little alien video i made,,1,1.0,0,6,little alien video made,29.0,1
2348,r5w4mu,aliens,Majestic-12,,1,1.0,0,1,majestic,12.0,1
2349,r5vymd,aliens,I remember there was a video years back about how a US president found out the truth about our existence and truth of aliens. I believe the US president started sobbing over the truth and couldn’t except it.,I remember there was a video years back about how a US president found out the truth our existence and truth of aliens. I believe the US president started sobbing over the truth and couldn’t except it. Anyone has a clue what I’m talking about lol? And what did he find out?,1,1.0,318,38,remember video year back president found truth existence truth alien believe president started sobbing truth except remember video year back president found truth existence truth alien believe president started sobbing truth except anyone clue talking lol find,481.0,1
2350,r5vxcq,aliens,Strange cloud images in Brazil,,1,1.0,0,5,strange cloud image brazil,31.0,1
2351,r5uwy5,aliens,Who do you think Billy Corgan Shapeshifter friend was? And why has he still not said anything more about it yet? It's only a month away from 2022 and still nothing?,"Didn't he say he was going to put it in his book? I know he said something about that too. Who ever it was it would have had to be with someone he was intimate with because they were naked in front of him. 

So any fans here know his private life or even better know him personally? Who was he in a relationship with in that time frame?  May we can narrow it down. You can tell he believes it himself so I am intrigued.",1,1.0,164,31,think billy corgan shapeshifter friend still said anything yet month away still nothing say going put book know said something ever would someone intimate naked front fan know private life even better know personally relationship time frame may narrow tell belief intrigued,584.0,1
2352,r5tu9p,aliens,Yesterday in the netherlands,,1,1.0,0,4,yesterday netherlands,29.0,1
2354,r5rq43,aliens,Five things That Would Make Aliens Go WTF," https://link.medium.com/IlbDjyYVBlb 

Not sure if you guys will find this amusing or not my friends and I did but it's not a serious article. Feel free to take down my post if u guys only want serious articles",1,1.0,10,8,five thing would make alien wtf link medium com ilbdjyyvblb sure guy find amusing friend serious article feel free take post guy want serious article,252.0,1
2355,r5rkef,aliens,Core Secrets,,1,1.0,0,2,core secret,13.0,1
2356,r5p68f,aliens,Guys,IT'S CATS,1,1.0,2,1,guy cat,14.0,1
2357,r5ojej,aliens,"Alien organisms could hitch a ride on our spacecraft and contaminate Earth, scientists warn",,1,1.0,0,14,alien organism could hitch ride spacecraft contaminate earth scientist warn,92.0,1
2358,r5nfoa,aliens,Whatever happened to UAPtheory.com?,This guy was all the rage about 6 months ago and now he has completely fallen off. Did he not have any actual physics experience and get exposed as a charlatan? Did something else happen? I thought his website was cool even if a bit unscientific. What happened??,1,1.0,14,4,whatever happened uaptheory com guy rage month ago completely fallen actual physic experience get exposed charlatan something else happen thought website cool even bit unscientific happened,298.0,1
2359,r5mq7p,aliens,Here’s this little alien sandbox I found at the plant nursery to make you smile.,,1,1.0,0,15,little alien sandbox found plant nursery make smile,81.0,1
2360,r5me6e,aliens,The reason they don't tell us the truth,"The reason they won't disclose the truth is that it's upsetting, because the truth is humanity is not just the product of aliens but we are still their slaves, and there food source. The secret society's throughout time knew the truth and hid it to maintain there positions of power. The aliens known as the reptillians own us and this planet. It's definitely sobering, they were the annunaki.",1,1.0,142,8,reason tell truth reason disclose truth upsetting truth humanity product alien still slave food source secret society throughout time knew truth hid maintain position power alien known reptillians planet definitely sobering annunaki,433.0,1
2361,r5m3xb,aliens,"hey everyone, I'm a musician who believes in aliens and I wrote a song about them called They Are Waiting. Hope it's okay that I share it here, would love any feedback!",,1,1.0,0,32,hey everyone musician belief alien wrote song called waiting hope okay share would love feedback,169.0,1
2363,r5iya4,aliens,"Would you assume that aliens are on the internet, or not?","Obviously no one knows, but one might still think that one or the other is more likely.",1,1.0,256,11,would assume alien internet obviously one know one might still think one likely,145.0,1
2364,r5itxf,aliens,I can prove that intelligent aliens DO exist and DO visit earth,"Here is a logical proof that aliens exist that are at least as intelligent as humans, and that they visit earth.

* Assumption: alien microbes exist on another planet.
* The proof: to these microbes, we humans are aliens. Thus, intelligent aliens exist and visit earth.

Any thoughts?",1,1.0,33,12,prove intelligent alien exist visit earth logical proof alien exist least intelligent human visit earth assumption alien microbe exist another planet proof microbe human alien thus intelligent alien exist visit earth thought,348.0,1
2365,r5i5zo,aliens,I think it was UFO,,1,1.0,0,5,think ufo,19.0,1
2368,r5gr65,aliens,opinion: aliens don't need to be super complex to be an advanced civilization.,"i believe that even unicellular aliens could form an advanced civilization. this is because on earth, there is one creature that is just a colony of unicellular creatures, yet they are hyper intelligent. i'm talking about the slime mould. the slime mould is just a prokaryotic organism but it has a very high level of sapience. it can solve equations, control probes, solve mazes, and even play the piano (with electrodes of course)! and if something that simple can evolve to be so intelligent, then life on other worlds could be forming civilizations of their own.",1,1.0,36,13,opinion alien need super complex advanced civilization believe even unicellular alien could form advanced civilization earth one creature colony unicellular creature yet hyper intelligent talking slime mould slime mould prokaryotic organism high level sapience solve equation control probe solve maze even play piano electrode course something simple evolve intelligent life world could forming civilization,645.0,1
2369,r5fetz,aliens,"ALIEN INCONSISTENCY: Why aren’t crop circles a thing anymore, also with a camera on every corner in the world and in every pocket, why is it always some grainy flip phone quality video? Can no one catch a craft in 4K?",I mean seriously we have high def pics of the surface of other plants but can’t seem to ever get still clear video of a solid craft. And where did all the crop circles go? They were huge in the 90s.,1,1.0,233,41,alien inconsistency crop circle thing anymore also camera every corner world every pocket always grainy flip phone quality video one catch craft mean seriously high def pic surface plant seem ever get still clear video solid craft crop circle huge,416.0,1
2370,r5f5vp,aliens,Are we paying attention to Dr. Michael Levin’s research yet? What do you think are the implications for the E.T. subject?,,1,1.0,0,21,paying attention michael levin research yet think implication subject,122.0,1
2371,r5en37,aliens,Sighting in Mexico,"&amp;#x200B;

https://preview.redd.it/ihhlls1ntn281.jpg?width=720&amp;format=pjpg&amp;auto=webp&amp;s=3116b9ee70ee59924dea55a7982df67bc0ad8106",1,1.0,2,3,sighting mexico amp preview redd ihhlls ntn jpg width amp format pjpg amp auto webp amp dea,161.0,1
2373,r5dlr7,aliens,Any thoughts on the claims of Emery Smith?,Some pretty wild claims from him. I wonder what y'all may think of this? Any credibility to his claims? Does anyone have any good info to share?,1,1.0,8,8,thought claim emery smith pretty wild claim wonder may think credibility claim anyone good info share,187.0,1
2374,r5dlqn,aliens,Wow! First step in the creation of an EBEN (extra terrestrial biological entity),"[Worlds first living robots can now reproduce](https://amp.cnn.com/cnn/2021/11/29/americas/xenobots-self-replicating-robots-scn/index.html)


i’m sure the grays are watching intently. This is probably where it all started at. I think we’re still a ways off from having it go out and mow the lawn, clean the toilet, fix me dinner and tuck me into bed; and throw in a little cuddle time.",1,1.0,1,13,wow first step creation eben extra terrestrial biological entity world first living robot reproduce amp cnn com cnn america xenobots self replicating robot scn index html sure gray watching intently probably started think still way mow lawn clean toilet fix dinner tuck bed throw little cuddle time,466.0,1
2376,r5clbe,aliens,"Hey guys, I’m looking for an interview with a soldier (I think Greer is interviewing him) who saw an egg shaped UFO crashed in the side of a ridge and he went to investigate and saw a purple/green liquid. I can’t find it and know it was posted in this sub recently.",As the title states.,1,1.0,0,52,hey guy looking interview soldier think greer interviewing saw egg shaped ufo crashed side ridge went investigate saw purple green liquid find know posted sub recently title state,286.0,1
2377,r5ah66,aliens,Alien exploration,"Would it not seem logical, that instead of aliens visiting us in spacecraft or otherwise, they would probably send technical devices for long times to study the earth. Lime we send satellites and rovers out. 

So they may have send tech long ago before humankind. Perhaps they are so far away it takes thousands of years to reach us, therefore , gaining in the time it takes to gain information on our planet, thousands of years have gone by. 

Just saying, it's more likely that they would investigate before sending a being here . Maybe? Just thinking. 

There even perhaps could be old tech buried in oceans or somewhere we have not found yet, that we know of.",1,1.0,10,2,alien exploration would seem logical instead alien visiting spacecraft otherwise would probably send technical device long time study earth lime send satellite rover may send tech long ago humankind perhaps far away take thousand year reach therefore gaining time take gain information planet thousand year gone saying likely would investigate sending maybe thinking even perhaps could old tech buried ocean somewhere found yet know,681.0,1
2378,r56m7e,aliens,Telescope catches strange aerial phenomena above the Moon,,1,1.0,0,8,telescope catch strange aerial phenomenon moon,58.0,1
2379,r55e55,aliens,Implications of UFO Phenomena with Jacques Vallee,,1,1.0,1,7,implication ufo phenomenon jacques vallee,50.0,1
2380,r55d3k,aliens,Any inner earth believers in here?,"I know you are in here so let’s talk. Just watched a great video by Mr. Mythos on YouTube about inner earth. I’m decently familiar with with the Bryd diary, nazis and Antarctica, the beings in these inner world (which seem like the Nordics we talk about), operation high jump and the US missions sent to destroy the remaining nazis. Please let me know your thoughts I think it’s fascinating and wanna know more!",1,1.0,65,6,inner earth believer know let talk watched great video mythos youtube inner earth decently familiar bryd diary nazi antarctica being inner world seem like nordic talk operation high jump mission sent destroy remaining nazi please let know thought think fascinating wanna know,446.0,1
2381,r54ghl,aliens,Travis Walton,,1,1.0,1,2,travis walton,14.0,1
2383,r51beb,aliens,Strange Lights In The Sky,,1,1.0,0,5,strange light sky,26.0,1
