,id,subreddit,title,selftext,score,upvote_ratio,num_comments,word_length,text,text_length,is_aliens
678,rgyel0,space,Question to space enthusiast,I am currently working construction and it is getting to the point that I am burning out. I miss the days where I could stay up all night and image the universe. Are people interested in commission based imaging?,1,1.0,0,4,question space enthusiast currently working construction getting point burning miss day could stay night image universe people interested commission based imaging,241.0,0
680,rgy904,space,James Webb: A $10bn machine in search of the end of darkness,,1,1.0,0,12,james webb machine search end darkness,61.0,0
681,rgxufb,space,A simple Israeli invention could help 2.5 billion people – and NASA,,1,1.0,0,12,simple israeli invention could help billion people nasa,68.0,0
682,rgxtn6,space,NASA: Webb telescope launch delayed by communication problem,,1,1.0,0,8,nasa webb telescope launch delayed communication problem,61.0,0
683,rgxa6n,space,"NASA spacecraft ‘touches’ the Sun for the first time ever. The Parker Solar Probe has passed through a boundary and into the Sun’s atmosphere, gathering data that will help scientists better understand stars.",,1,1.0,0,33,nasa spacecraft touch sun first time ever parker solar probe passed boundary sun atmosphere gathering data help scientist better understand star,209.0,0
685,rgx52f,space,ExoMars discovers hidden water in Mars’ Grand Canyon,,1,1.0,0,8,exomars discovers hidden water mar grand canyon,53.0,0
686,rgwwpj,space,Does every black hole contain a singularity?,,1,1.0,0,7,every black hole contain singularity,45.0,0
687,rgw4d0,space,James Webb Space Telescope launch delayed to Christmas Eve,,1,1.0,0,9,james webb space telescope launch delayed christmas eve,59.0,0
688,rgw0ln,space,"New rocket test facility under construction in Scotland, UK",,1,1.0,0,9,new rocket test facility construction scotland,60.0,0
689,rgvk5h,space,Telegram channel for astronomy and astrophoto enthusiasts,"Hello everybody,

I’ve created a Telegram channel for all astronomy and astrophotography enthusiasts.  
Sometimes it’s nice to have a live chat without spamming a forum.

**Link to join:**  
https://t.me/theastrochannel

Telegram is a lovely communicator, you can install it on smartphones, Mac, Windows and Linux.

It also doesn't spy on it's users etc., which is a big plus for some of us.

You can always mute the channel to not get constant notifications.

The channel was just created so obviously it might be a little bit empty for now. :D

Thanks!",1,1.0,0,7,telegram channel astronomy astrophoto enthusiast hello everybody created telegram channel astronomy astrophotography enthusiast sometimes nice live chat without spamming forum link join theastrochannel telegram lovely communicator install smartphones mac window linux also spy user etc big plus always mute channel get constant notification channel created obviously might little bit empty thanks,612.0,0
690,rgvfqm,space,Astronomers peer deeper into Milky Way's heart than ever before with new telescope images,,1,1.0,0,14,astronomer peer deeper milky way heart ever new telescope image,90.0,0
695,rgu6u3,space,🔴 LIVE SLOT PRAGMATIC PLAY BARENG KAPTEN GACOR | SLOT GACOR HARI INI | INDO GACOR 88 PART 28,,1,1.0,1,19,live slot pragmatic play bareng kapten gacor slot gacor hari ini indo gacor part,93.0,0
696,rgtuh1,space,"What is the cosmic web? - When you zoom far enough out, our universe has a very unusual structure.",,1,1.0,0,19,cosmic web zoom far enough universe unusual structure,99.0,0
697,rgthak,space,https://twitter.com/xp32021/status/1471007208490024961?s=28,,1,1.0,0,1,twitter com status,60.0,0
698,rgt79q,space,Let go,,1,1.0,0,2,let,7.0,0
699,rgsyuk,space,Musk Tweets New SpaceX Program to Use CO2 in Atmosphere As Rocket Fuel,,1,1.0,0,13,musk tweet new spacex program use atmosphere rocket fuel,71.0,0
700,rgsii2,space,This is the first spacecraft to 'touch' the sun,,1,1.0,0,9,first spacecraft touch sun,48.0,0
703,rgqhmx,space,"If Earth had rings, how would that affect the tides?",,1,1.0,0,10,earth ring would affect tide,53.0,0
704,rgp8j4,space,Best books to come out in the past couple of years?,"Looking for a Christmas gift for my Dad.

His favorite topics are the Apollo program, Astrophysics and Astrobiology. 

He's read everything by Neil Degrasse Tyson and seemingly everything on the Apollo program that came out before 2019.

Any newer books that might interest him? Thanks",1,1.0,0,11,best book come past couple year looking christmas gift dad favorite topic apollo program astrophysics astrobiology read everything neil degrasse tyson seemingly everything apollo program came newer book might interest thanks,337.0,0
705,rgp1wq,space,Rocket Lab's latest acquisition focuses on solar panels - SolAreo - the worlds largest production of high performing space solar cells,,1,1.0,0,21,rocket lab latest acquisition focus solar panel solareo world largest production high performing space solar cell,135.0,0
706,rgogyf,space,https://youtu.be/GSOFG3pCv4w,,1,1.0,0,1,youtu gsofg pcv,29.0,0
708,rgmx42,space,Float Away to this Ambient Space music track,,1,1.0,0,8,float away ambient space music track,45.0,0
709,rgmcph,space,Webb Space Telescope now Launching no earlier than Dec 24th,,1,1.0,0,10,webb space telescope launching earlier dec,60.0,0
710,rglj2n,space,"Russia's cosmos town, an isolated relic of Soviet glory",,1,1.0,0,9,russia cosmos town isolated relic soviet glory,56.0,0
711,rgkxu2,space,Starship size perspective,,1,1.0,1,3,starship size perspective,26.0,0
712,rgkrlv,space,NASA’s Webb Telescope Will Have the Coolest Camera in Space,,1,1.0,0,10,nasa webb telescope coolest camera space,60.0,0
713,rgkqbr,space,"NASA craft 'touches' sun for 1st time, dives into atmosphere",,1,1.0,0,10,nasa craft touch sun time dive atmosphere,61.0,0
714,rgjzag,space,The space industry had a monumental 2021,,1,1.0,0,7,space industry monumental,41.0,0
715,rgjp3t,space,"Webb Telescope Reddit AMA in r/AskScience on Dec. 16 from 1-2 pm ET! Hear from Webb experts at NASA, ESA, Canadian Space Agency, Space Telescope Science Institute, Northrop Grumman &amp; Ball Aerospace",,1,1.0,0,32,webb telescope reddit ama askscience dec hear webb expert nasa esa canadian space agency space telescope science institute northrop grumman amp ball aerospace,202.0,0
716,rgjh79,space,"For The First Time, NASA ‘Touches’ The Sun",,1,1.0,0,8,first time nasa touch sun,43.0,0
717,rgioca,space,"Canadian MDA new LEO satellites will see a needle in a haystack, and then thread it.",,1,1.0,0,16,canadian mda new leo satellite see needle haystack thread,85.0,0
718,rghwec,space,Japanese billionaire Yusaku Maezawa delivers first Uber Eats in space,,1,1.0,0,10,japanese billionaire yusaku maezawa delivers first uber eats space,70.0,0
719,rgglml,space,Real or fake,,1,1.0,0,3,real fake,13.0,0
721,rggejm,space,"Ex-SpaceX Engineer Claims Elon Musk Is 'Sadistic,' Misogyny Is 'Rampant'",,1,1.0,0,10,spacex engineer claim elon musk sadistic misogyny rampant,73.0,0
722,rgftuq,space,"At SpaceX, we're told we can change the world. I couldn't, however, stop getting sexually harassed.",,1,1.0,0,16,spacex told change world however stop getting sexually harassed,100.0,0
723,rgfp2y,space,SpaceX turned Apple employee speaks out about sexual harassment at space company,,1,1.0,0,12,spacex turned apple employee speaks sexual harassment space company,81.0,0
724,rgf2w1,space,"If we imagine a spinning pair of space habitats connected by a long cable, how could one realise without windows that the centrifugal gravity is not real gravity?",,1,1.0,0,28,imagine spinning pair space habitat connected long cable could one realise without window centrifugal gravity real gravity,163.0,0
725,rgesof,space,Deepest ever images of Milky Way show stars moving around supermassive black hole,,1,1.0,0,13,deepest ever image milky way show star moving around supermassive black hole,82.0,0
727,rgdha7,space,Webb placed on top of Ariane 5,,1,1.0,0,7,webb placed top ariane,31.0,0
728,rgdh0y,space,"A concept of an Interplanetary Space Station I made one year ago based on the spaceship ""Hermes"" of the film ""The Martian""",,1,1.0,0,22,concept interplanetary space station made one year ago based spaceship hermes film martian,123.0,0
729,rgdg2w,space,The James Webb Space Telescope is hoisted nearly 40 meters before securing it to the top of the Ariane 5 rocket.,,1,1.0,0,21,james webb space telescope hoisted nearly meter securing top ariane rocket,113.0,0
730,rgdbzt,space,Spacecraft enters the Sun's corona for the first time in history,,1,1.0,0,11,spacecraft enters sun corona first time history,65.0,0
731,rgd3z3,space,With Michael Strahan On Board Blue Origin Plans To Launch Its First Crew Of Six To Space,,1,1.0,0,17,michael strahan board blue origin plan launch first crew six space,89.0,0
732,rgcttc,space,"China won't talk arms control with U.S. on Earth, Biden seeks a deal in space",,1,1.0,0,15,china talk arm control earth biden seek deal space,78.0,0
733,rgch6g,space,"If Earth's axial tilt were closer to Uranus's, let's say 90° exactly, what would that effect?","Would it change the weather patterns? Any effects on the tides? I'm sure timezones would end up going south-north versus the east-west method we currently use, at least based on how we define these under the current planetary orientation. 

What about the equator, would it be subject to greater seasonal and temperature variation?",1,1.0,0,16,earth axial tilt closer uranus let say exactly would effect would change weather pattern effect tide sure timezones would end going south north versus east west method currently use least based define current planetary orientation equator would subject greater seasonal temperature variation,425.0,0
734,rgccjs,space,Watching interstellar for the first time and it makes me want to go through a wormhole. I saw a YouTube video on needing Exotic Matter yo help make one. Is that true and how could we obtain it?,,1,0.99,0,38,watching interstellar first time make want wormhole saw youtube video needing exotic matter help make one true could obtain,194.0,0
735,rgbzt7,space,Telescope Nabs Astonishing Image of Planet Orbiting Star Pair - Nerdist,,1,1.0,0,11,telescope nabs astonishing image planet orbiting star pair nerdist,72.0,0
736,rgbtmm,space,Leaky valve issue forces Boeing to swap out Starliner’s service module,,1,1.0,0,11,leaky valve issue force boeing swap starliner service module,71.0,0
737,rgbj6a,space,Should NASA Receive more government funding? [QUESTION],"I'm doing an essay project in my ELA class on the topic ""Why NASA should get more government funding"" 

For this I've been trying to get data and see the views from other perspectives. So here's why I posted this: Should NASA Get more funding (Yes or No) and Why or Why Not? 

I want to try and get data from both sides of the argument and see how different other peoples views are. 

Thanks in advance if you respond to this!",1,1.0,0,7,nasa receive government funding question essay project ela class topic nasa get government funding trying get data see view perspective posted nasa get funding yes want try get data side argument see different people view thanks advance respond,482.0,0
738,rgbckf,space,Webb and Ariane 5 – Preparing for launch,,1,1.0,0,8,webb ariane preparing launch,41.0,0
739,rgambd,space,What would the edge of the universe look like?,"If we could theoretically stay within a visible distance of the edge of the universe as it’s expanding, what would we see? Would it be looking into a pure void or would the amount of energy needed to fuel such expansion be blinding? Obviously this is all speculation but I still want to know if the more likelier options since it’s been on my mind.",1,1.0,0,9,would edge universe look like could theoretically stay within visible distance edge universe expanding would see would looking pure void would amount energy needed fuel expansion blinding obviously speculation still want know likelier option since mind,395.0,0
740,rga3ex,space,Mysterious STEVE light emissions emanate from Earth's magnetosphere,,1,1.0,0,8,mysterious steve light emission emanate earth magnetosphere,68.0,0
741,rg9wij,space,Satellite operators criticize “extreme” megaconstellation filings,,1,1.0,0,6,satellite operator criticize extreme megaconstellation filing,66.0,0
742,rg9t83,space,The European Southern Observatory’s Very Large Telescope Interferometer (ESO’s VLTI) has obtained the deepest &amp; sharpest images of the region around the supermassive black hole at the center of our galaxy. The new images zoom in 20 times more than what was possible before the VLTI.,,1,1.0,0,46,european southern observatory large telescope interferometer eso vlti obtained deepest amp sharpest image region around supermassive black hole center galaxy new image zoom time possible vlti,287.0,0
743,rg9lcg,space,Boeing swaps out the faulty Starliner service module originally planned for Orbital Flight Test-2 with the upcoming Crew Flight Test service module.,,1,1.0,0,22,boeing swap faulty starliner service module originally planned orbital flight test upcoming crew flight test service module,149.0,0
744,rg9et7,space,Does anyone know why the Rocketwatchr seems to be down? Thanks!,,1,1.0,0,11,anyone know rocketwatchr seems thanks,64.0,0
745,rg9d94,space,why do we exist?why does anything exist?i’ve been thinking about it a lot. who is behind the creation of all this? when did it start and when will it end?,,1,1.0,0,30,exist anything exist thinking lot behind creation start end,155.0,0
746,rg9b49,space,Boeing swaps out the faulty Starliner service module originally planned for the Crew Flight Test with the next flight's (OFT-2) service module.,,1,1.0,0,22,boeing swap faulty starliner service module originally planned crew flight test next flight oft service module,144.0,0
747,rg9939,space,ESA: Webb and Ariane 5 – Preparing for launch,,1,1.0,0,9,esa webb ariane preparing launch,46.0,0
748,rg983d,space,What would happen if all celestial bodies lost their gravitational pull?,A friend of mine had the idea of this happening and we thought a lot about it but didn't come to a proper solution. Any answers would be greatly appreciated by both of us :D,1,1.0,0,11,would happen celestial body lost gravitational pull friend mine idea happening thought lot come proper solution answer would greatly appreciated,246.0,0
749,rg91md,space,I need help with what i saw,I was walking home when a light went up in the sky and then just went out. What could it have been?,1,1.0,0,7,need help saw walking home light went sky went could,127.0,0
750,rg8uzo,space,"Rocket Lab has just announced a new rocket, Neutron! It's a big deal!",,1,1.0,0,13,rocket lab announced new rocket neutron big deal,70.0,0
751,rg8tt7,space,Mars helicopter Ingenuity flies for 17th time on Red Planet,,1,1.0,0,10,mar helicopter ingenuity fly time red planet,60.0,0
752,rg8j4k,space,"How to see comet Leonard, according to the researcher who discovered it",,1,1.0,0,12,see comet leonard according researcher discovered,72.0,0
753,rg8be1,space,Universe with Brian Cox,"So, he mentioned about a theory before the Big Bang, with ripples of energy before a hydrogen molecule grew in size and created the Big Bang.  There’s also been discussions around the Big Crunch as a way of the current universe as we understand it to essentially recollapses into itself. 

Is it at all possible that the “universe” is just expanding and collapsing time and time again?  That’s at least some substantial evidence as to why hydrogen and helium exists? 


Side note; I’m just a housewife with no prior knowledge of physics or astronomy, so please be gentle!",1,1.0,0,4,universe brian cox mentioned theory big bang ripple energy hydrogen molecule grew size created big bang also discussion around big crunch way current universe understand essentially recollapses possible universe expanding collapsing time time least substantial evidence hydrogen helium exists side note housewife prior knowledge physic astronomy please gentle,595.0,0
755,rg7vdh,space,Former space agency engineer charged by Mounties claimed to have overseen major Canadian projects,,1,1.0,0,14,former space agency engineer charged mountie claimed overseen major canadian project,98.0,0
756,rg7rkr,space,"Former NASA deputy administrator Lori Garver's book ""Escaping Gravity: My Quest to Transform NASA and Launch a New Space Age"" will come out June 7",,1,1.0,0,25,former nasa deputy administrator lori garver book escaping gravity quest transform nasa launch new space age come june,147.0,0
757,rg7k0p,space,What are some hypotheses or theories that JWST will be able tobprove/disprove early in its mission?,,1,1.0,0,16,hypothesis theory jwst able tobprove disprove early mission,100.0,0
758,rg6yh7,space,Spelunking on the moon: New study explores lunar pits and caves,,1,1.0,0,11,spelunking moon new study explores lunar pit cave,64.0,0
759,rg6ctv,space,"Is it possible that other intelligent civilizations could have developed and died out on the other planets in our solar system? Given the vast amounts of time involved, would their be any evidence of their existence left for us to find?","Lately, I have been wondering if a tool using, moderately advanced civilization had developed on Mars or Venus when conditions were right, would there be any archeological evidence left for us to find given the significant changes to those planets over their existence? 

Obviously Venus presents incredible challenges, but could excavations on Mars yield fossils or even artifacts if a tool using civilization had existed there at some point in it’s wet past?",1,1.0,0,41,possible intelligent civilization could developed died planet solar system given vast amount time involved would evidence existence left find lately wondering tool using moderately advanced civilization developed mar venus condition right would archeological evidence left find given significant change planet existence obviously venus present incredible challenge could excavation mar yield fossil even artifact tool using civilization existed point wet past,697.0,0
760,rg69d1,space,Es,"I am sending you my Labrador retriever puppy, Akiara, to play with in DogLife. Tap the link below to add Akiara to your kennel:

https://doglifeapp.com/YY0AMB",1,1.0,0,1,sending labrador retriever puppy akiara play doglife tap link add akiara kennel doglifeapp com amb,161.0,0
761,rg67nj,space,Caught a meteor on phone bottom right- Akron Ohio,,1,1.0,0,9,caught meteor phone bottom right akron ohio,50.0,0
762,rg66ks,space,Could someone explain me how is this possible?,,1,1.0,0,8,could someone explain possible,47.0,0
763,rg5o7g,space,"How likely is it space ""wraps"" around itself?","Meaning, when you move straight ahead, you'll end up back at your point of origin without meeting a boundary. If you could see infinite distances (ignoring light lag), you'd see the back of yourself.",1,1.0,0,8,likely space wrap around meaning move straight ahead end back point origin without meeting boundary could see infinite distance ignoring light lag see back,245.0,0
764,rg5nl5,space,is this a planet or a spec on my camera? these photos were taken months apart using my phone.,,1,1.0,0,19,planet spec camera photo taken month apart using phone,94.0,0
765,rg5lbk,space,This Year’s Geminids Meteor Show to Begin on December 14; NASA will Show the Livestream,,1,1.0,0,15,year geminids meteor show begin december nasa show livestream,88.0,0
766,rg5jv6,space,"Has the ""Expanding Multiverse"" theory got any truth/accuracy too it?","I once heard Brian Cox talk about a theory where there is a ""Metaverse"" so to speak ( I forget the exact term) that is constantly expanding at an insanely fast rate, but it slows down on occasion and when it does that excess energy gets dumped and causes something akin to a big bang. 

He speculated that our universe is an outcome of those slow downs and that there are potentially many more Universes with the same cause.

Is this theory seen as credible in the Science community or largely disregarded?",1,1.0,0,10,expanding multiverse theory got truth accuracy heard brian cox talk theory metaverse speak forget exact term constantly expanding insanely fast rate slows occasion excess energy get dumped cause something akin big bang speculated universe outcome slow down potentially many universe cause theory seen credible science community largely disregarded,575.0,0
767,rg5jim,space,Please add points,[Presentation](https://youtu.be/eu00LzOEJaY),1,1.0,0,3,please add point presentation youtu lzoejay,62.0,0
768,rg59qy,space,Starship lookin' gud,,1,1.0,1,3,starship lookin gud,21.0,0
769,rg4ljd,space,How different it is to experience a gamma ray burst at it's origin?,"Studies on it's effects on Earth have been made, but if there was a planet literally in front of the black hole that generates the burst, not even light years away, and this planet is the first thing that the burst hits. Would there be a difference on it's power? Greater repercussions? Could the planet experience directly some form of heat?",1,1.0,0,13,different experience gamma ray burst origin study effect earth made planet literally front black hole generates burst even light year away planet first thing burst hit would difference power greater repercussion could planet experience directly form heat,410.0,0
770,rg4icy,space,Double drop test success for ExoMars parachutes (esa),,1,1.0,0,8,double drop test success exomars parachute esa,54.0,0
771,rg4hqp,space,2021 Was the Weirdest Year in Space Ever,,1,1.0,0,8,weirdest year space ever,41.0,0
772,rg3xrj,space,Why aren’t there any pics of planets from ground telescope at observatories?,"I understand that ppl upload pictures of planets from their own personal telescopes daily. However , I can’t find any pics of planets; taken from observatories.

The most powerful ground telescope is The Hobby–Eberly Telescope (HBT).

But yet, you can’t find any pics of what the telescope is capable of; when it comes to viewing planets. This goes for other famous ground telescope as well.

Any idea why? Or can someone link me to a website that had pics of planets , taken from observatories/ground telescope",1,1.0,0,12,pic planet ground telescope observatory understand ppl upload picture planet personal telescope daily however find pic planet taken observatory powerful ground telescope hobby eberly telescope hbt yet find pic telescope capable come viewing planet go famous ground telescope well idea someone link website pic planet taken observatory ground telescope,588.0,0
773,rg3w8t,space,Suggest points to add,[Video](https://youtu.be/eu00LzOEJaY),1,1.0,0,4,suggest point add video youtu lzoejay,59.0,0
775,rg3txj,space,New to this terrain,Please review my presentation [Video](https://youtu.be/eu00LzOEJaY),1,1.0,0,4,new terrain please review presentation video youtu lzoejay,87.0,0
776,rg3tce,space,SPacetech any suggestions on presentation,[Video](https://youtu.be/eu00LzOEJaY),1,1.0,0,5,spacetech suggestion presentation video youtu lzoejay,79.0,0
777,rg3t0q,space,SpaceTech presentation for your opinion,,1,1.0,0,5,spacetech presentation opinion,40.0,0
778,rg3sh0,space,Please check my presentation,[Here](https://youtu.be/eu00LzOEJaY),1,1.0,0,4,please check presentation youtu lzoejay,65.0,0
780,rg30wd,space,Einstein's theory of general relativity passes one of its toughest tests yet,,1,1.0,0,12,einstein theory general relativity pass one toughest test yet,77.0,0
781,rg2ro7,space,I think i cracked something in my sleep,"I was dreaming avout whether space is infinite or not. And i came to the conclusion that space is finite. Due to the fact that its expanding, which means its a finite amount of space thats getting larger with time i/e space is lager tomorrow than it is today, which is messurable?? 
Am i being dumb or what?",2,1.0,0,8,think cracked something sleep dreaming avout whether space infinite came conclusion space finite due fact expanding mean finite amount space thats getting larger time space lager tomorrow today messurable dumb,347.0,0
782,rg27hh,space,Amazon Web Services,,1,1.0,0,3,amazon web service,20.0,0
783,rg13kk,space,SpaceX's proposed Mars ISRU sabatier plant for methalox generation,,1,1.0,1,9,spacex proposed mar isru sabatier plant methalox generation,67.0,0
784,rg112m,space,Universe's creation,,1,1.0,0,2,universe creation,20.0,0
785,rg0u9z,space,Bioastronautics degree help??,,1,1.0,0,3,bioastronautics degree help,30.0,0
786,rg0myt,space,"Monthly Space News, December 11, 2021",,1,1.0,0,6,monthly space news december,38.0,0
787,rg0kvj,space,Would it be technically possible to return to Apollo 17’s landing site and fire up the moon buggy again? Like if you went with a new battery for it or whatever….,,1,1.0,0,31,would technically possible return apollo landing site fire moon buggy like went new battery whatever,162.0,0
788,rfzv3h,space,The rings planet - Saturn,,1,1.0,1,5,ring planet saturn,26.0,0
790,rfzj76,space,An object is now orbiting alongside China’s Shijian-21 debris mitigation satellite,,1,1.0,0,11,object orbiting alongside china shijian debris mitigation satellite,83.0,0
791,rfzbrm,space,The newest (Space Coms Network) and oldest (petroglyphs) human communications just a few miles from each other.,,1,1.0,0,17,newest space coms network oldest petroglyph human communication mile,112.0,0
