,id,subreddit,title,selftext,score,upvote_ratio,num_comments,word_length,text,text_length,is_aliens
0,rmzn01,space,Does anyone know what this ive seen?,,1,1.0,1,7,anyone know ive seen,37.0,0
1,rmzl73,space,NASA Plans a Nuclear Plant on Moon,,1,1.0,0,7,nasa plan nuclear plant moon,35.0,0
2,rmz1sr,space,I think black holes might be pockets,"Pockets specifically for holding things in ""for safe keeping"" 

and spitting them back out a ridiculous amount of time later.. to insure that the universe is forever recycling itself",1,1.0,0,7,think black hole might pocket pocket specifically holding thing safe keeping spitting back ridiculous amount time later insure universe forever recycling,219.0,0
3,rmxpmy,space,"Astronomers have produced the most comprehensive image of radio emission from the nearest actively feeding supermassive black hole to Earth. When viewed from Earth, the eruption from Centaurus A now extends eight degrees across the sky—the length of 16 full Moons laid side by side.",,1,1.0,0,45,astronomer produced comprehensive image radio emission nearest actively feeding supermassive black hole earth viewed earth eruption centaurus extends eight degree across sky length full moon laid side side,283.0,0
4,rmxo1b,space,I considered this one of the sharpest moon image in the world and the final picture is composite of 380 RAW image.,,1,1.0,0,22,considered one sharpest moon image world final picture composite raw image,115.0,0
5,rmxd5t,space,My friend was on NPR discussing JWST! “The launch of the James Webb Space Telescope is almost here. What will we discover?”,,1,1.0,0,22,friend npr discussing jwst launch james webb space telescope almost discover,124.0,0
6,rmx8ec,space,NASA's $10 Billion Plan to Scan the Edge of Our Universe,,1,1.0,0,11,nasa billion plan scan edge universe,57.0,0
7,rmx324,space,"With Its Single “Eye,” NASA’s DART Returns First Images from Space",,1,1.0,0,11,single eye nasa dart return first image space,67.0,0
8,rmwxzz,space,JWST launch Date and time,James Webb Space Telescope will launch on the Christmas day! Timing: 12:20pm UTC. The livestream is already scheduled 90 mins before the launch time. Live stream link: https://youtu.be/7nT7JGZMbtM,1,1.0,0,5,jwst launch date time james webb space telescope launch christmas day timing utc livestream already scheduled min launch time live stream link youtu jgzmbtm,222.0,0
10,rmwv2q,space,"At long last, the world's most powerful space telescope is ready to launch",,1,1.0,0,13,long last world powerful space telescope ready launch,75.0,0
11,rmwtuv,space,Marina Koren on Twitter,,1,1.0,0,4,marina koren twitter,24.0,0
12,rmwkv3,space,Can anyone help identifying what this project was?,,1,1.0,0,8,anyone help identifying project,51.0,0
13,rmwgi3,space,"Old home video of Space Shuttle Columbia launching in April 1998 (STS-90) filmed from a plane. I was 10 years old, sorry for the camera shake!",,1,1.0,0,26,old home video space shuttle columbia launching april sts filmed plane year old sorry camera shake,143.0,0
14,rmwcxj,space,"The Insane Engineering of James Webb Telescope (apologies if repost, absolutely blows my mind as an engineer and a space enthusiast and a human being)",,1,1.0,0,25,insane engineering james webb telescope apology repost absolutely blow mind engineer space enthusiast human,151.0,0
15,rmw0sa,space," The first ever  Gaming and  NFT $Elite Forces to host a $50,000 Warzone Tournament! Join now before it is too late! Whitelist for presale available! ",,1,1.0,0,29,first ever gaming nft elite force host warzone tournament join late whitelist presale available,156.0,0
16,rmveo9,space,Does anyone know which orbit the JWST will use around L2?,"I've read on Wikipedia that the orbit could be either a Torus, Halo or Lissajous, depending on the synodic month, and will only be determined after launch. Are there any more information about this?",1,1.0,0,11,anyone know orbit jwst use around read wikipedia orbit could either torus halo lissajous depending synodic month determined launch information,256.0,0
17,rmvbzt,space,Why NASA's James Webb Space Telescope will orbit nearly 1 million miles from Earth,,1,1.0,0,14,nasa james webb space telescope orbit nearly million mile earth,83.0,0
18,rmuuci,space,Loved this recent article: 5 of the most exciting telescope pictures,,1,1.0,0,11,loved recent article exciting telescope picture,69.0,0
19,rmu4a3,space,How Webb and Hubble space telescopes are different,,1,1.0,0,8,webb hubble space telescope different,51.0,0
20,rmtpe3,space,Ac Repair and Service in Dubai | 24 Hour Ac Repairing Dubai |0501920047,,1,1.0,0,13,repair service dubai hour repairing dubai,72.0,0
21,rmt1a5,space,Why Scientists Waited 50 Years to Study This Moon Dust,,1,1.0,0,10,scientist waited year study moon dust,55.0,0
22,rmstb1,space,Rocket Lab's Neutron Rocket's Innovative Design Explained By Peter Beck - CEO of Rocket Lab,,1,1.0,0,15,rocket lab neutron rocket innovative design explained peter beck ceo rocket lab,92.0,0
23,rmsryg,space,"Just saw this over Ishigaki island, Japan moving very fast. What is it? It’s not Lens flair. The whole sky looked like this.",,1,1.0,0,23,saw ishigaki island japan moving fast lens flair whole sky looked like,125.0,0
24,rms0ix,space,Astronomers find record-breaking haul of starless 'rogue' planets,,1,1.0,0,8,astronomer find record breaking haul starless rogue planet,66.0,0
25,rmr9eq,space,How to Watch the Launch of the James Webb Space Telescope (and Why It’s Big Deal),,1,1.0,0,16,watch launch james webb space telescope big deal,82.0,0
26,rmqxgr,space,Why do we assume alien life conforms to Earth conditions…?,"Why do we assume that alien life follows the same rules life follows on Earth…? Like drinking water, breathing the same type of air we do, or assuming that they live in the same temperature-like conditions?

Why do we not think that there couldn’t be lava people? Or aliens that live on planets -500 degrees. Honestly, I just feel like we’re WAY off our metrics on what conditions life can live under. Maybe that’s why we haven’t found any signs of alien life, because we’re thinking about this the wrong way.",1,1.0,0,10,assume alien life conforms earth condition assume alien life follows rule life follows earth like drinking water breathing type air assuming live temperature like condition think lava people alien live planet degree honestly feel like way metric condition life live maybe found sign alien life thinking wrong way,568.0,0
28,rmpueo,space,"Genuine question, soften your insults:","Theoretically, would it be possible to construct a slingshot that is already in space?  

Would said slingshot propel crafts faster than modern technology allows us to, especially in a vacuum?",1,1.0,0,5,genuine question soften insult theoretically would possible construct slingshot already space would said slingshot propel craft faster modern technology allows especially vacuum,231.0,0
29,rmpt0e,space,How Do I add Binance smart chain to My Metamask Account?,,1,1.0,0,11,add binance smart chain metamask account,57.0,0
30,rmpioz,space,"Where do photons go if they've been emitted but are destined to never be absorbed, and would these photons traveling ad infinitum define the edge of the material universe?","I have searched for an answer to my question online and am constantly blocked by the myriad articles and Q&amp;A sites about how photons are absorbed. I want to know about the photos that will *never be absorbed by anything*, assuming this is possible.",1,1.0,0,29,photon emitted destined never absorbed would photon traveling infinitum define edge material universe searched answer question online constantly blocked myriad article amp site photon absorbed want know photo never absorbed anything assuming possible,424.0,0
31,rmphi9,space,"Felt like sharing it, its so informative and always amazes be evrytime I watch it.",[https://www.youtube.com/watch?v=Lp39wU03Zu4](https://www.youtube.com/watch?v=Lp39wU03Zu4),1,1.0,0,15,felt like sharing informative always amazes evrytime watch youtube com watch youtube com watch,173.0,0
33,rmoafe,space,Oh my god,,1,1.0,1,3,god,10.0,0
34,rmntgj,space,Earth’s doppelgangers,,1,1.0,0,2,earth doppelganger,22.0,0
35,rmltv2,space,"2022 Will Be a Big Year for Space Exploration - Missions to Mars, Jupiter, and—yes—Texas are all part of the next wave of space research previously delayed by Covid-19.",,1,1.0,0,29,big year space exploration mission mar jupiter yes texas part next wave space research previously delayed covid,169.0,0
36,rml1sh,space,How would gravitational time dilation be viewed from someone away from a gravity field?,I don't know if this is true because i got the basis of this from Interstellar: How time moves more slowly around areas with tons of mass. How would it look like if a person was in orbit or on a different planet and they were observing a robot or human on a planet with a massive amount of gravity. Would it look like they were moving in slow motion?,1,1.0,0,14,would gravitational time dilation viewed someone away gravity field know true got basis interstellar time move slowly around area ton mass would look like person orbit different planet observing robot human planet massive amount gravity would look like moving slow motion,438.0,0
37,rmkfey,space,IT HAPPENED! SpaceX Is FINALLY Launching Their New Starship To Orbit 2021!!,,1,1.0,0,12,happened spacex finally launching new starship orbit,76.0,0
38,rmk9co,space,Would it be possible for 3 moons to line up either on top of each other or to the side of each other?,Hi I’m an aspiring writer. For a magical event in my story i want the world’s 3 moons to line up either on top of each other or side by side at a certain time on a certain day but I’m wondering if this is possible? If not i might still do it and just say it’s magic but I’d love for it to be scientifically possible. Also I’m wondering how 3 moons might effect a world in other ways? Thanks so much for reading!,1,1.0,0,23,would possible moon line either top side aspiring writer magical event story want world moon line either top side side certain time certain day wondering possible might still say magic love scientifically possible also wondering moon might effect world way thanks much reading,513.0,0
39,rmizeb,space,"NASA, Partners Confirm Webb Launch on Dec. 25 – James Webb Space Telescope",,1,1.0,0,13,nasa partner confirm webb launch dec james webb space telescope,75.0,0
40,rmih7q,space,James Webb Space Telescope: an interview with Nikole Lewis &amp; Ishan Mishra at the Carl Sagan Institute,,1,1.0,0,17,james webb space telescope interview nikole lewis amp ishan mishra carl sagan institute,106.0,0
41,rmif04,space,Why is JWST planned to orbit an unstable Lagrange point rather than a stable one?,,1,1.0,0,15,jwst planned orbit unstable lagrange point rather stable one,82.0,0
42,rmh7ix,space,Why Venus May Have Life with Dr. Janusz Petkowski,,1,1.0,0,9,venus may life janusz petkowski,50.0,0
43,rmgepy,space,"Using data from several telescopes worldwide, a team of astronomers discovered at least 70 free-floating planets -- planets that wander the cosmos without orbiting a star -- in the Milky Way, marking the largest group of rogue planets ever found.",,1,1.0,0,40,using data several telescope worldwide team astronomer discovered least free floating planet planet wander cosmos without orbiting star milky way marking largest group rogue planet ever found,247.0,0
44,rmgeck,space,"William Shatner, 90, involved in car crash in California",,1,1.0,0,9,william shatner involved car crash california,57.0,0
45,rmg2jz,space,"NASA, Partners Confirm Webb Launch on Dec. 25 – Things are looking promising for a Christmas launch",,1,1.0,0,17,nasa partner confirm webb launch dec thing looking promising christmas launch,100.0,0
46,rmfy6m,space,NASA Twitter: Still on for Webb telescope launch on Christmas day,,1,1.0,0,11,nasa twitter still webb telescope launch christmas day,66.0,0
47,rmfsx6,space,"Can someone explain why there are 2 lights in the sky, orbiting each other?",,1,1.0,0,14,someone explain light sky orbiting,76.0,0
48,rmfo7m,space,Where can I watch the pre-launch conference for James Webb that I believe happened @2pm?,"I would greatly appreciate a link, thanks!",1,1.0,0,15,watch pre launch conference james webb believe happened would greatly appreciate link thanks,131.0,0
49,rmfmqb,space,Astronomers discover up to 170 ‘rogue’ Jupiter-size exoplanets 420 light years away from Earth - the largest group of its kind found yet,,1,1.0,0,23,astronomer discover rogue jupiter size exoplanets light year away earth largest group kind found yet,137.0,0
50,rmf63v,space,James Webb: Weather shifts telescope launch to 25 December,,1,1.0,0,9,james webb weather shift telescope launch december,59.0,0
51,rmf39w,space,Black holes &amp; time?,"If the theory is true that black holes bend time, if you went into a black hole and got slowed down, for you would it feel like you’re there for almost an eternity?",1,1.0,0,4,black hole amp time theory true black hole bend time went black hole got slowed would feel like almost eternity,188.0,0
52,rmed8e,space,Engine controller replacement details behind Artemis 1 launch delay,,1,1.0,0,9,engine controller replacement detail behind artemis launch delay,68.0,0
53,rme2pj,space,The Insane Engineering of the JWT. Very informative video behind the who/what/where/why/how of this $10B telescope.,,1,1.0,0,16,insane engineering jwt informative video behind telescope,116.0,0
54,rme2nd,space,Wouldn’t the first words on the moon be “Contact Light” spoken by buzz aldrin and not “one small step”?,Ever since i was little I always felt like buzz was cheated in that regard. Anyone else out there agree with me or am I just weird?,1,1.0,0,19,first word moon contact light spoken buzz aldrin one small step ever since little always felt like buzz cheated regard anyone else agree weird,235.0,0
55,rmdzl5,space,Found this video to be very informative in an ELI5 type manner of the engineering of the JWT,,1,1.0,1,18,found video informative eli type manner engineering jwt,93.0,0
56,rmdlb3,space,James Webb telescope: how it could uncover some of the universe's best-kept secrets,,1,1.0,0,13,james webb telescope could uncover universe best kept secret,84.0,0
57,rmckzi,space,"God entered into my body, as a ghostly body, and begins ripping my face, shoots gum disease in mouth",,1,1.0,0,19,god entered body ghostly body begin ripping face shoot gum disease mouth,101.0,0
58,rmcksv,space,Could dark matter be information flowing between galaxies? Like the electric signals flowing between the synapses in the brain?,,1,1.0,0,19,could dark matter information flowing galaxy like electric signal flowing synapsis brain,128.0,0
59,rmc7ur,space,Secrets of the Cosmic Microwave Background,,1,1.0,0,6,secret cosmic microwave background,43.0,0
60,rmc122,space,Astronomers capture black hole eruption spanning 16 times the full Moon in the sky,,1,1.0,0,14,astronomer capture black hole eruption spanning time full moon sky,83.0,0
61,rmbswi,space,OC,,1,1.0,1,1,,3.0,0
62,rmbqt6,space,Learn Cubase in 5minutes #shorts,,1,1.0,0,5,learn cubase minute short,33.0,0
63,rmbgrp,space,(my first post here) Is it possible....,"To do something like...

Simulating somehing like, bubbles (universes) in a way:

\-they sometimes split into other universes, in different ways.

\--in every bubble the four fundamental forces are having different factors

\--some do ""fast inflation  just after birth""

\--(other stuff seen in ""how the universe works: the first second""

\-some collide

\-some expand at diferent rates

\-all move

\-of course simulating matter is a problem, i do not know in this kind of simulation how many matter could be simulated. 

&amp;#x200B;

if you have ideas for details, Comments!",1,1.0,0,7,first post possible something like simulating somehing like bubble universe way sometimes split universe different way every bubble four fundamental force different factor fast inflation birth stuff seen universe work first second collide expand diferent rate move course simulating matter problem know kind simulation many matter could simulated amp idea detail comment,617.0,0
64,rmb1ds,space,Amateur astronomers help scientists confirm evidence of a new class of galac­tic nebulae,,1,1.0,0,13,amateur astronomer help scientist confirm evidence new class galac tic nebula,89.0,0
65,rma3gi,space,"I am completely aware that the James Webb telescope is huge, but what exactly will it allow us to see that previous telescopes could not?",,1,1.0,0,25,completely aware james webb telescope huge exactly allow see previous telescope could,138.0,0
66,rm91om,space,How to watch NASA's James Webb Space Telescope launch online in several languages on Christmas Day,,1,1.0,0,16,watch nasa james webb space telescope launch online several language christmas day,99.0,0
67,rm8pii,space,"Why will it take six months to see JWST's first science images? (A detailed write up by Dr. Heidi B. Hammel, an Interdisciplinary Scientist on the James Webb Telescope Project)",,1,1.0,0,30,take six month see jwst first science image detailed write heidi hammel interdisciplinary scientist james webb telescope project,177.0,0
68,rm8n1l,space,SpaceX’s culture must change,,1,1.0,0,4,spacex culture must change,29.0,0
69,rm8hn2,space,A Holiday Check-in with New Horizons,,1,1.0,0,6,holiday check new horizon,37.0,0
70,rm8dpi,space,"NASA's 'trailer' for the James Webb telescope. I gotta say, NASA has really upped their PR game the last 10 years.",,1,1.0,0,21,nasa trailer james webb telescope gotta say nasa really upped game last year,115.0,0
71,rm7p06,space,Webb Telescope unfolding,How Webb Telescope Is to Unfold in NASA’s Most Complex Spacecraft Plan https://www.wsj.com/articles/how-webb-telescope-is-to-unfold-in-nasas-most-complex-spacecraft-plan-11640169007,1,1.0,0,3,webb telescope unfolding webb telescope unfold nasa complex spacecraft plan wsj com article webb telescope unfold nasa complex spacecraft plan,206.0,0
72,rm7o71,space,SpacX orbital flight test ground RUD and implications,"So if the first orbital flight test explodes on the pad, the resulting carnage will be to big to really contemplate...won't this potential scenerio completely shut down the whole site for what could be years? There would be federal investigations, enviromental rereviews, resident outrage etc...isn't there much more at stake for SpaceX if they don't get it up in the air at least few Kilometers? Is this another more important reason to build another launch and catch tower and support in FL?",1,1.0,0,8,spacx orbital flight test ground rud implication first orbital flight test explodes pad resulting carnage big really contemplate potential scenerio completely shut whole site could year would federal investigation enviromental rereviews resident outrage etc much stake spacex get air least kilometer another important reason build another launch catch tower support,547.0,0
73,rm7hh8,space,About Neutron Stars and Pulsars,,1,1.0,0,5,neutron star pulsar,32.0,0
74,rm73ch,space,Question regarding JWST and “seeing into the past”?,,1,1.0,1,8,question regarding jwst seeing past,52.0,0
75,rm4tm1,space,"Dating Dating Dating, create an account on this site for dating your favorite boy and girl friend. This is the best website for dating. Add me by creating an account here for dating with me, my account name is Emma613.if you open an account you will get 5 $ bonus . Click link",,1,1.0,1,53,dating dating dating create account site dating favorite boy girl friend best website dating add creating account dating account name emma open account get bonus click link,277.0,0
76,rm4t7y,space,High wind postpones launch of NASA's newest space telescope,,1,1.0,0,9,high wind postpones launch nasa newest space telescope,60.0,0
77,rm3xmf,space,"Starbase, TX: 6:00 am",,1,1.0,0,4,starbase,22.0,0
78,rm3vzn,space,Comet Leonard's discoverer explains how the unusual object was found,,1,1.0,0,10,comet leonard discoverer explains unusual object found,69.0,0
79,rm3oqq,space,Theories,what are the most integral theories of the universe for you?,1,1.0,0,1,theory integral theory universe,69.0,0
80,rm37v8,space,Received a bunch of “blueprint” photos mostly of the Apollo missions for Christmas. What are these?,,1,1.0,1,16,received bunch blueprint photo mostly apollo mission christmas,100.0,0
81,rm356a,space,Anyone else looking forward to the next James Webb telescope delay announcement?,Because I am so looking forward to the launch next year ..... right?,1,1.0,0,12,anyone else looking forward next james webb telescope delay announcement looking forward launch next year right,149.0,0
82,rm2yde,space,The 'huge year' for space investing expected to continue into 2022,,1,1.0,0,11,huge year space investing expected continue,67.0,0
83,rm2ptp,space,Hubble Uzay Teleskobu,,1,1.0,0,3,hubble uzay teleskobu,22.0,0
84,rm24vy,space,Winter solstice 2021 brings the year's longest night to Northern Hemisphere,,1,1.0,0,11,winter solstice brings year longest night northern hemisphere,76.0,0
85,rm1l46,space,UAE-Bahraini nanosatellite Light-1 successfully arrives at International Space Station,,1,1.0,1,9,uae bahraini nanosatellite light successfully arrives international space station,87.0,0
86,rm1efr,space,SPACESHIP-01,,1,1.0,0,1,spaceship,13.0,0
87,rm1bim,space,SPACESHIP,,1,1.0,0,1,spaceship,10.0,0
88,rm0bd3,space,Does anyone know why The Hunt for Planet B is not available to watch?,"I’m really excited about the JWST launch and wanted to watch this doc with my family. It aired in November, but that’s all I can find searching online? No streaming on CNN. Are they waiting until after launch to make it available? 

I wish they would release it before the launch, would be so cool to watch prior  like space x’s inspiration4 doc :(",1,1.0,0,14,anyone know hunt planet available watch really excited jwst launch wanted watch doc family aired november find searching online streaming cnn waiting launch make available wish would release launch would cool watch prior like space inspiration doc,418.0,0
89,rlzxsj,space,JWST delayed again.,"Christmas Day now.

 
 
https://www.nasa.gov/feature/james-webb-space-telescope-launch-update",0,0.5,0,3,jwst delayed christmas day nasa gov feature james webb space telescope launch update,113.0,0
90,rlzvck,space,Space tattoo - can you help?,Help!  I saw a really cool space tattoo on here just a bit ago and should have saved it.  Two forearms - one with phases of the moon and one with the solar system.  Anyone have the link? Thanks!,1,1.0,0,6,space tattoo help help saw really cool space tattoo bit ago saved two forearm one phase moon one solar system anyone link thanks,223.0,0
91,rlzkv2,space,Tarantula Nebula,,1,1.0,1,2,tarantula nebula,17.0,0
92,rlzci0,space,Did someone imagine working at NASA?,"As a kid I was dreaming of space exploring and thinking about all the  space things is still blowing my mind to this day. I imagined working at NASA as a scientist. I believed I could discover interstellar flights, intelligent life and just help to expand our knowledge about space. 
At present I'm working as a software developer and I don't regret it. But maybe someday I will be working at NASA, who knows.",1,1.0,0,6,someone imagine working nasa kid dreaming space exploring thinking space thing still blowing mind day imagined working nasa scientist believed could discover interstellar flight intelligent life help expand knowledge space present working software developer regret maybe someday working nasa know,446.0,0
93,rlyunu,space,Is itPossible to Use Topographical Mapping on Alpha Centauri?,"What if we used our systems that do topographical mapping of the Earth and aimed them at Alpha Centauri. Would it be possible to get a reading back in just 9 years, and if the signal was continuous, keep receiving it for a time?",1,1.0,0,9,itpossible use topographical mapping alpha centauri used system topographical mapping earth aimed alpha centauri would possible get reading back year signal continuous keep receiving time,290.0,0
94,rlyepa,space,Anyone know which TV stations will be showing the James Webb Telescope launch? I want to DVR it.,"I’m not a morning person, so I doubt that I’ll be awake at 7:20 AM EST.  :)",1,1.0,0,18,anyone know station showing james webb telescope launch want dvr morning person doubt awake est,172.0,0
95,rlybw7,space,9 engine starship firing its engines,,1,1.0,0,6,engine starship firing engine,37.0,0
96,rlxhye,space,"Flat Earther here. I’ve written a horror novel which includes some Flat Earth stuff in it. It’s free till Christmas, along with several of my other popular books. Enjoy and Merry Christmas!", [https://www.amazon.com/gp/product/B09JVCYK5F](https://www.amazon.com/gp/product/B09JVCYK5F),1,1.0,0,32,flat earther written horror novel includes flat earth stuff free till christmas along several popular book enjoy merry christmas amazon com product jvcyk amazon com product jvcyk,283.0,0
97,rlxhxz,space,Meet Our Solar System's Twin Planetary System - Trappist-1 System.,,1,1.0,0,10,meet solar system twin planetary system trappist system,67.0,0
98,rlwj6v,space,How many new galaxies will we be capable of seeing with JWST?,The observable universe was estimated to be 2 Trillion galaxies. The “observable universe” is defined as what could potentially be observed with out existing equipment. Once JWST is up how much will the observable universe expand? Are there any estimates?,1,1.0,0,12,many new galaxy capable seeing jwst observable universe estimated trillion galaxy observable universe defined could potentially observed existing equipment jwst much observable universe expand estimate,317.0,0
