,id,subreddit,title,selftext,score,upvote_ratio,num_comments,word_length,text,text_length,is_aliens
1492,r9s9u8,space,Could someone explain why the light is centered in the middle of this shot? (iphone 13 mini),,1,1.0,0,17,could someone explain light centered middle shot iphone mini,93.0,0
1493,r9rncf,space,Evolution of the Moon,,1,1.0,0,4,evolution moon,22.0,0
1494,r9r7wo,space,"Some photos I took at Nigardsbreen, Norway. Andromeda galaxy visible on last two pics.",,1,1.0,0,14,photo took nigardsbreen norway andromeda galaxy visible last two pic,87.0,0
1495,r9r0g3,space,The Fish Head Nebula [OC],,1,1.0,0,5,fish head nebula,26.0,0
1496,r9qq34,space,JWST Wallpaper I made to kill time while waiting for the launch,,1,1.0,0,12,jwst wallpaper made kill time waiting launch,64.0,0
1497,r9qpi5,space,I attached my DSLR to my Telescope then combined over 400 exposures to create this HDR 98% Mineral Moon composite!,,1,1.0,1,20,attached dslr telescope combined exposure create hdr mineral moon composite,115.0,0
1498,r9qmjk,space,STS-61 Extravehicular Activity on the Hubble Space Telescope repair. December 1993.,,1,1.0,0,11,sts extravehicular activity hubble space telescope repair december,84.0,0
1499,r9qj4b,space,SpinLaunch hurls satellites into space using a spinning machine,,1,1.0,0,9,spinlaunch hurl satellite space using spinning machine,64.0,0
1500,rmwa8h,aliens,Astronomers detected strange signal from Proxima Centauri!,,1,1.0,0,7,astronomer detected strange signal proxima centauri,59.0,1
1501,rmv0y8,aliens,I love alien films and stories. I came up with my own alien story idea and I'd like to hear opinions on how this scenario would affect the planet and population in general?,The earth gets infected by a space cloud or nebula.  It changes the chemistry of our rain and there are creatures inside of it that hunt down whatever is on a planet when it rains.  I figured all alien life wouldn't be intelligent.  Some of those beings may also be feral depending on their origin.,1,1.0,0,33,love alien film story came alien story idea like hear opinion scenario would affect planet population general earth get infected space cloud nebula change chemistry rain creature inside hunt whatever planet rain figured alien life intelligent being may also feral depending origin,471.0,1
1502,rmu72o,aliens,"Sorry guys, but i don't think inteligent life exists.","Common forms of life yes, but not life like us. 

For what we know, life is very difficult to be form. To exist life in Earth, we needed a equilibrium very great of the elements, distance of the sun, etc. Just if a small detail change, and we would never existed. 

In our Earth, we needed many years to really develop a inteligent form of life after years of dinosaurs and other living there...and we almost got extincted many times.

We are alone....",1,1.0,0,9,sorry guy think inteligent life exists common form life yes life like know life difficult form exist life earth needed equilibrium great element distance sun etc small detail change would never existed earth needed many year really develop inteligent form life year dinosaur living almost got extincted many time alone,506.0,1
1504,rmt74v,aliens,𝟸𝟶𝟶-ʏᴇᴀʀ-ᴏʟᴅ ᴘᴀɪɴᴛɪɴɢ ᴅᴇsᴄʀɪʙᴇs sʜᴀᴘᴇsʜɪғᴛɪɴɢ ᴜғᴏ sᴇᴇɴ ᴏᴠᴇʀ ʙʀɪᴛᴀɪɴ sᴋɪᴇs ɪɴ 𝟷𝟽𝟾𝟹 - News Today,,1,1.0,0,14,news today,95.0,1
1506,rmt5h0,aliens,"Former Apollo Astronaut Claimed Ancient Alien Astronauts Created Humans, Evidence In Sumerian Texts",,1,1.0,0,13,former apollo astronaut claimed ancient alien astronaut created human evidence sumerian text,100.0,1
1509,rms5fe,aliens,Will Humanity Ever Leave The Galaxy,,1,1.0,0,6,humanity ever leave galaxy,36.0,1
1510,rmrjkj,aliens,Melting Ice Cap leads to UFO being uncovered in Antarctica? (YouTube video),,1,1.0,0,12,melting ice cap lead ufo uncovered antarctica youtube video,76.0,1
1511,rmr99l,aliens,My Christmas gift to myself came a few days early!,,1,1.0,0,10,christmas gift came day early,51.0,1
1512,rmr7xq,aliens,"What is that bright light? It’s brighter than the North Star, Orion’s Belt and seems closer than the moon. Also, I checked the Night Sky app and there weren’t any planets near. I see this light everyday at different hours but always in the same general area.",,1,1.0,0,47,bright light brighter north star orion belt seems closer moon also checked night sky app planet near see light everyday different hour always general area,259.0,1
1514,rmogpe,aliens,Lue Elizondo's infamous twitter ghost account shared this intriguing tweet today.,,1,1.0,0,11,lue elizondo infamous twitter ghost account shared intriguing tweet today,82.0,1
1515,rml3ga,aliens,"I compiled 38 drawn pictures, 8 video interviews, 6 map references and a Reddit AMA from the students that were at the 1994 Ariel School UFO Incident in Ruwa, Zimbabwe. Every adult student still sticks with their story: They saw UAP land and humanoid beings emerge before them. Links in comments",,1,1.0,1,51,compiled drawn picture video interview map reference reddit ama student ariel school ufo incident ruwa zimbabwe every adult student still stick story saw uap land humanoid being emerge link comment,296.0,1
1517,rmkzic,aliens,Chemogenesis? C'mon.,So I'm trying the 7 day trial of Gaia on Amazon.  I'm currently watching a Richard Doty interview where he claims knowledge of an alien species that essentially ate itself for nourishment.  Can any of you think of a single reason why I should give credence to anything Doty claims at this point?,1,1.0,0,2,chemogenesis mon trying day trial gaia amazon currently watching richard doty interview claim knowledge alien specie essentially ate nourishment think single reason give credence anything doty claim point,316.0,1
1518,rmjuui,aliens,Undoubtedly the Best Avi Loeb interview 10.12.2021,,1,1.0,0,7,undoubtedly best avi loeb interview,51.0,1
1520,rmhrsm,aliens,Why Can't We Find Aliens?,,1,1.0,0,5,find alien,26.0,1
1522,rmhok1,aliens,"Elon tells Joe Rogan he is an alien, now listen this",,1,1.0,0,11,elon tell joe rogan alien listen,53.0,1
1524,rmgt8m,aliens,What if the truth and the future are just really disappointing,"What if it's not possible for any biological species to ever achieve space travel.

The way things are looking with our species, we will essentially become obsolete by AI. The AI would be the evolved species that would achieve things like space travel, while humans, having ruined the climate, retreat into a virtual world.

What if every alien species follows a similar progression? We are looking for humanoid, biological aliens, when the reality could be a universe of computers. Just a theory.",1,1.0,0,11,truth future really disappointing possible biological specie ever achieve space travel way thing looking specie essentially become obsolete would evolved specie would achieve thing like space travel human ruined climate retreat virtual world every alien specie follows similar progression looking humanoid biological alien reality could universe computer theory,560.0,1
1525,rmgkvi,aliens,Sub for encounters?,"I'd like to read some first hand accounts of encounters with actual entities. I see a lot of posts about UFO sightings, but what about meeting the occupants?",1,1.0,0,3,sub encounter like read first hand account encounter actual entity see lot post ufo sighting meeting occupant,177.0,1
1526,rmfy7x,aliens,Do you think this was Tom DeLonge’s way to introduce aliens to the California way of life?,,1,1.0,0,17,think tom delonge way introduce alien california way life,91.0,1
1528,rme4fl,aliens,Original news paper article from McMinnville Oregon UFO,,1,1.0,0,8,original news paper article mcminnville oregon ufo,56.0,1
1529,rmdfv2,aliens,Jeff Goldblum talks about holding a secret about extraterrestrials during a GQ interview.,,1,1.0,0,13,jeff goldblum talk holding secret extraterrestrial interview,90.0,1
1530,rmd0ar,aliens,How many claims of female aliens?,"I have always imagined aliens as dudes or asexual beings, and have not heard of any accounts of people having experiences of female aliens.

Are there any prominent stories of female alien experiences?",1,1.0,0,6,many claim female alien always imagined alien dude asexual being heard account people experience female alien prominent story female alien experience,235.0,1
1533,rm9utr,aliens,Aerospace Employee Describes Viewing Secret Documents and Pictures of Aliens and UFOs,,1,1.0,0,12,aerospace employee describes viewing secret document picture alien ufo,86.0,1
1534,rm9umn,aliens,Alien life in Venus?,,1,1.0,0,4,alien life venus,21.0,1
1535,rm9204,aliens,Darwen ufo aka triangular shaped police helicopter entering worm hole.,,1,1.0,0,10,darwen ufo aka triangular shaped police helicopter entering worm hole,71.0,1
1536,rm90x3,aliens,Darwen ufo,,1,1.0,0,2,darwen ufo,11.0,1
1543,rm7odz,aliens,Reason To Believe,,1,1.0,0,3,reason believe,18.0,1
1545,rm6kqy,aliens,"According to excerpts from the notes and documents of Matilda O’Donnell McElroy, Senior Master Sergeant Women’s Army Air Force Medical Corp claimed that she interviewed an alien named “Airl” who told her where they had come from and why they came to the Earth.",,1,1.0,0,44,according excerpt note document matilda donnell mcelroy senior master sergeant woman army air force medical corp claimed interviewed alien named airl told come came earth,261.0,1
1546,rm4li6,aliens,"""The Jersey Platypus"" by me",Painting I made with some childlike wonder. Mother ship at the top with aliens all over,1,1.0,0,5,jersey platypus painting made childlike wonder mother ship top alien,115.0,1
1549,rm16qp,aliens,Still close up of Darwen ufo this morning. The frame before it disappeared. Is it not a triangular shaped craft of some kind entering a portal or worm hole???,,1,1.0,0,29,still close darwen ufo morning frame disappeared triangular shaped craft kind entering portal worm hole,159.0,1
1550,rm0ngn,aliens,Something big changes the earth,,1,1.0,0,5,something big change earth,32.0,1
1551,rlzmzl,aliens,"UFO over Darwen England today 0700 hrs orb, shape-shifting then vanishes.",,1,1.0,0,11,ufo darwen england today hr orb shape shifting vanishes,74.0,1
1552,rlzhm1,aliens,Inflatable Planes Could Search for Alien Life in the Clouds of Venus,,1,1.0,0,12,inflatable plane could search alien life cloud venus,69.0,1
1553,rly42d,aliens,Do you think that men tend to be more interested in these topics (UFOs and/or aliens) than women?,"For my part I think so, although I don't know the reason?",1,1.0,0,18,think men tend interested topic ufo alien woman part think although know reason,155.0,1
1554,rlxqxr,aliens,Why the fuck do some people on here think we're aliens and that aliens dropped us on this planet,"Just because they check in on us doesn't mean we're their relatives. They are simply studying different species. Us being aliens sounds ridiculous, we just happen to evolve to become the apex predator. Even if they look similar, it's because their planet evolved in similar ways. If we all got a DNA test, it'd say we're -100.0% related. We are from this planet, WE REP EARTH. GANG SHIT 🌎☮🖖",1,0.99,0,19,fuck people think alien alien dropped planet check mean relative simply studying different specie alien sound ridiculous happen evolve become apex predator even look similar planet evolved similar way got dna test say related planet rep earth gang shit,487.0,1
1555,rluan5,aliens,"Our Grey Alien ""Cubed Creatures""",,1,1.0,1,5,grey alien cubed creature,33.0,1
1556,rltyfi,aliens,Could aliens be another future humans that are ahead of us modern humans?,Aliens are really humans that are another homo species to us Homo sapiens. What do you think???,1,1.0,0,13,could alien another future human ahead modern human alien really human another homo specie homo sapiens think,169.0,1
1559,rlpxwu,aliens,ALIEN FUCK FARM (music vid inspired by Stardust Ranch),,1,1.0,0,9,alien fuck farm music vid inspired stardust ranch,55.0,1
1560,rlpn3c,aliens,Guys the Easter island heads have bodies underground! How do people people not know this?!,,1,1.0,0,15,guy easter island head body underground people people know,91.0,1
1561,rlpi4l,aliens,Strange thought,What if area 51 holds alien space  and another site holds alien life,1,1.0,0,2,strange thought area hold alien space another site hold alien life,84.0,1
1562,rlpcle,aliens,Does little greys works for reptilian,"I was watching an abduction documentary where all abductee were abducted by greys but when they were being experimented on or tortured in some lab,  few of them saw reptilian and even human faces. 


So Is this common theory in UFOs circle that small greys works for reptilian ??

Thanks


Thanks",1,1.0,0,6,little grey work reptilian watching abduction documentary abductee abducted grey experimented tortured lab saw reptilian even human face common theory ufo circle small grey work reptilian thanks thanks,334.0,1
1563,rlp17z,aliens,"Nephilim, aka Men of the Renown, are the offspring of the Renown. So who are the Renown? Are they an Alien Species?","From what it sounds like is that these ""Renown"" slept with their ""livestock"" and the mess got cleaned up by a great flood.  What do you think?",1,1.0,0,22,nephilim aka men renown offspring renown renown alien specie sound like renown slept livestock mess got cleaned great flood think,258.0,1
1567,rlnhwp,aliens,Why would they visit?,Honestly why would a advanced civilization come here. Surely not for resources the outer solar system has all they could ever want. In your opinion why would they even look this way?,1,1.0,0,4,would visit honestly would advanced civilization come surely resource outer solar system could ever want opinion would even look way,204.0,1
1568,rlmelf,aliens,This sub is full of misinformation and delusional people,title says it all,1,1.0,0,9,sub full misinformation delusional people title say,74.0,1
1571,rlkg94,aliens,"Sorry mods I didn't understand auto mods/once again Annunaki are Sumerian allegory/no ""presumption"" here only reason",,1,1.0,0,16,sorry mod understand auto mod annunaki sumerian allegory presumption reason,117.0,1
1572,rlkavv,aliens,"Aliens That Were Witnessed By The Late Dr. Norman Bergrun, High Ranking Scientist at NASA and Lockheed Martin","https://youtu.be/TPhIIjmTdLw


Later, many will find out why the world turned upside down after 2019. Keep this for a later time as it will make sense then. I'll give you some hints, HR1242, Coronation, Hebrew. Elijah Muhammad said the same thing decades earlier when people thought UFOs were fake.",1,1.0,0,18,alien witnessed late norman bergrun high ranking scientist nasa lockheed martin youtu tphiijmtdlw later many find world turned upside keep later time make sense give hint coronation hebrew elijah muhammad said thing decade earlier people thought ufo fake,408.0,1
1573,rlj8j3,aliens,I COME IN PEACE,,1,1.0,0,4,come peace,16.0,1
1574,rlhlsd,aliens,Today Show Segment on the new UFO legislation passed by Congress,,1,1.0,0,11,today show segment new ufo legislation passed congress,65.0,1
1575,rlhizg,aliens,Creating a book of the possible flora and fauna of a far off planet,,1,1.0,0,14,creating book possible flora fauna far planet,68.0,1
1576,rlggcb,aliens,Artwork by me. Info in dm 👽,,1,1.0,0,7,artwork info,28.0,1
1577,rlg6kg,aliens,False Flags,I often hear about false flags ... and I would imagine we the people would know right away if it was a false flag or not by the way we responded to such an attack. Am I off track here?,1,1.0,0,2,false flag often hear false flag would imagine people would know right away false flag way responded attack track,196.0,1
1578,rlfzse,aliens,Ppt presentation about aliens/extrarestrial life,I have to make a presentation about aliens do you guys have some suggestions for me?,1,1.0,0,5,ppt presentation alien extrarestrial life make presentation alien guy suggestion,133.0,1
1579,rlekep,aliens,Anunnaki are allegory taken out of context,,1,1.0,0,7,anunnaki allegory taken context,43.0,1
1581,rlavff,aliens,Artwork by me,,1,1.0,0,3,artwork,14.0,1
1582,rl9xjc,aliens,What if they came here to stop a nuclear war that happened in their past?," If we think about all the nuclear near escalations, they might have  already changed their past. Remember how the Cuba crisis ended? Or the  one Russian Commander who refused to launch the ICBM? It was just so weird.",1,1.0,0,15,came stop nuclear war happened past think nuclear near escalation might already changed past remember cuba crisis ended one russian commander refused launch icbm weird,291.0,1
1584,rl8y3w,aliens,small flying saucer at the beach,,1,1.0,0,6,small flying saucer beach,33.0,1
1585,rl5as6,aliens,This one’s for you all.,,1,1.0,0,5,one,24.0,1
1586,rl32kq,aliens,?/?/2022 - https://twitter.com/DISCLOSURE2022/status/1473104234098958344?s=20,,1,1.0,0,3,twitter com disclosure status,78.0,1
1587,rl2m2y,aliens,Aliens. Best Christmas movie ever.,,1,1.0,0,5,alien best christmas movie ever,35.0,1
1588,rl2lgx,aliens,I am from the moon also i am the president of the United states. I just got back a few days ago. A my clone was running things god bless,,1,1.0,0,30,moon also president united state got back day ago clone running thing god bless,137.0,1
1589,rl2hft,aliens,"My partner saw this face interrupting a dream where people was entering our room for an ""interview"". In the dream, this face showed to tell him to calm down. I never saw any description of such alien head before, have you? He doesnt like/follow ufo subject and said head looked like toon on 2nd pic.",,1,1.0,0,55,partner saw face interrupting dream people entering room interview dream face showed tell calm never saw description alien head doesnt like follow ufo subject said head looked like toon pic,300.0,1
1591,rl19b5,aliens,One of the Pyramids of Elysium on Mars. Almost 10 times taller than the Egyptian pyramids. More surround it and their origin is not concretely explained.,,1,1.0,0,26,one pyramid elysium mar almost time taller egyptian pyramid surround origin concretely explained,154.0,1
1592,rl16mk,aliens,New Ancient Aliens Debunking Video! Please watch,,1,1.0,0,7,new ancient alien debunking video please watch,49.0,1
1593,rl0fmf,aliens,Scientific community is finally giving us some attention with the stigma. Professor Simon is clearly not educated on the subject. Its up to us to educate the professors about the UAP subject because (clearly) they are day dreaming.,,1,1.0,0,38,scientific community finally giving attention stigma professor simon clearly educated subject educate professor uap subject clearly day dreaming,232.0,1
1594,rl0ex3,aliens,Video: UFOs in different areas in Egypt,,1,1.0,0,7,video ufo different area egypt,40.0,1
1595,rl08uw,aliens,"Our Human Attractiveness According to the ""Other People.""","Kinda dumb question but ... I've been studying this phenomenon as an amateur for years and we seem to quickly judge the appearance of each species as ""beautiful"" or ""scary"" based on human perception. For example, Nordic People are beautiful and insectoids as something else. Yet, to me, it seems we as humans vary greatly in appearance among one another, unlike many other ""beings."" I guess my question is first, do they have an opinion regarding our general looks and/or our individual looks? My guess would be they have no opinion regarding our physical being only our energy. Any thoughts?",1,1.0,0,8,human attractiveness according people kinda dumb question studying phenomenon amateur year seem quickly judge appearance specie beautiful scary based human perception example nordic people beautiful insectoids something else yet seems human vary greatly appearance among one another unlike many being guess question first opinion regarding general look individual look guess would opinion regarding physical energy thought,650.0,1
1596,rl06it,aliens,"The mysterious cube on the moon could be an underground storage facility, akin to the one in Norway","But instead of seeds, it's where all abductees semen/eggs are stored. Aliens are backing up humanity's DNA should an extinction event happen.",1,1.0,0,18,mysterious cube moon could underground storage facility akin one norway instead seed abductees semen egg stored alien backing humanity dna extinction event happen,241.0,1
1597,rkxoir,aliens,Do you believe Aliens globally document our behavior and decisions as tangible evidence and then use this to make a case that we are not worthy of being at their level?,"The might just see all the trash in our oceans.  Or bear witness to corruption of politicians working against the people they represent.  Even document dysfunctional developments and heinous behavior on a widespread level.

Do you think they weigh and determine our species worth?",1,1.0,0,31,believe alien globally document behavior decision tangible evidence use make case worthy level might see trash ocean bear witness corruption politician working people represent even document dysfunctional development heinous behavior widespread level think weigh determine specie worth,449.0,1
1598,rkxmo7,aliens,Concerns about the Dark Forest theory,"I’ve seen this theory popping up more and more— on this thread, suggested YouTube videos, etc.— and I’m a bit worried about it. I feel like it’s possible that the theory is being spread more in order to justify violence against other beings.

Does anyone else have thoughts on this or share the same concern?",1,1.0,0,6,concern dark forest theory seen theory popping thread suggested youtube video etc bit worried feel like possible theory spread order justify violence being anyone else thought share concern,346.0,1
1601,rkubts,aliens,Welcome to LV-426 Love..,,1,1.0,0,4,welcome love,25.0,1
1602,rktw2f,aliens,What if aliens came to our earth?,What could happen?,1,1.0,0,7,alien came earth could happen,52.0,1
1603,rktp6h,aliens,What could be the real reason behind the massive cover up of the UFO/UAP existence for decades?,I think reason behind massive coverup campaign all over the world will provide real answers now as It is certain that UAP/UFO exists( Pentagon released freaking videos for same.Even those didn’t officially release till leak happened ).I feel there should not be any questions about its existence at least.,1,1.0,0,17,could real reason behind massive cover ufo uap existence decade think reason behind massive coverup campaign world provide real answer certain uap ufo exists pentagon released freaking video even officially release till leak happened feel question existence least,401.0,1
1604,rktide,aliens,Pragmatic questions we should ask an extraterrestrial during an eventual contact,"Assuming you can keep your cool during an abduction or close encounter and there can be some kind of communication, what objective question would be useful asking? We can easily think on the classics: ""Who are you?"", ""Where are you from?"" and ""What do you want of us?"", on most accounts the answers have a varying degree of vagueness and are almost always a variation of the following:

*  we are friends/brothers
*  we came from such and such star/system/planet
*  we came to study/observe/guide

These maybe true but overused and lame. What questions would get us more useful or insightful answers?",1,1.0,0,11,pragmatic question ask extraterrestrial eventual contact assuming keep cool abduction close encounter kind communication objective question would useful asking easily think classic want account answer varying degree vagueness almost always variation following friend brother came star system planet came study observe guide maybe true overused lame question would get useful insightful answer,681.0,1
1606,rks0el,aliens,"We were made by the most intelligent beings on earth, to test how they would do on land?",,1,1.0,0,18,made intelligent being earth test would land,89.0,1
1607,rkqyr2,aliens,Other Humans,"Hi guys, 

My first post here, but I am obsessed with the concept of other life out there. 

I watch a lot of docs and stuff and I often think that nature is its own thing. Nobody controls it, or owns it etc. I believe ""the human"" is essentially one of the many blueprints of 'nature' as are all other lifeforms we know about (animals, mammals, reptiles, plants, etc).

I honestly believe there are other ""humans"" out there on other planets, who are just like us...possibly more or less evolved but nevertheless human by the defination of what makes us human.

Does anybody else share this belief? 

Thanks",1,1.0,0,2,human guy first post obsessed concept life watch lot doc stuff often think nature thing nobody control owns etc believe human essentially one many blueprint nature lifeforms know animal mammal reptile plant etc honestly believe human planet like possibly le evolved nevertheless human defination make human anybody else share belief thanks,619.0,1
1608,rkpees,aliens,"Since 2019, Army Counterintelligence Officer's Story Checked Out on Elizondo/DeLonge meeting.",,1,1.0,0,11,since army counterintelligence officer story checked elizondo delonge meeting,94.0,1
